{
  "schema_version": 2,
  "providers": [
    {
      "id": "opencode_anonymous",
      "kind": "open_code_anonymous",
      "endpoint_base": "https://opencode.ai/zen/v1",
      "api_key_env": null,
      "models": ["mimo-v2.5-free"],
      "model_protocols": {},
      "chat_completions_path": null,
      "cost_class": "zero",
      "estimated_cost_microusd_per_request": null,
      "privacy_class": "hosted_anonymous"
    }
  ],
  "single_reviewer": {
    "targets": [
      { "provider_id": "opencode_anonymous", "model": "mimo-v2.5-free" }
    ]
  },
  "ensemble": {
    "reviewer_a": {
      "targets": [
        { "provider_id": "opencode_anonymous", "model": "mimo-v2.5-free" }
      ]
    },
    "reviewer_b": {
      "targets": [
        { "provider_id": "opencode_anonymous", "model": "mimo-v2.5-free" }
      ]
    },
    "reviewer_c": {
      "targets": [
        { "provider_id": "opencode_anonymous", "model": "mimo-v2.5-free" }
      ]
    }
  },
  "challenger": {
    "targets": [
      { "provider_id": "opencode_anonymous", "model": "mimo-v2.5-free" }
    ]
  },
  "alternative_comparator": null,
  "review_budget": {
    "max_requests": 128,
    "max_input_bytes": 16777216,
    "max_output_tokens": 131072,
    "timeout_ms": 360000,
    "max_cost_microusd": 0,
    "allow_unknown_cost": false
  },
  "case_budgets": {
    "defaults": {
      "max_requests": 64,
      "max_input_bytes": 8388608,
      "max_output_tokens": 65536,
      "timeout_ms": 360000,
      "max_cost_microusd": 0,
      "allow_unknown_cost": false
    },
    "per_template": {}
  }
}
