{
  "schema_version": 2,
  "providers": [
    {
      "id": "opencode_anonymous",
      "kind": "open_code_anonymous",
      "endpoint_base": "https://opencode.ai/zen/v1",
      "api_key_env": null,
      "models": [
        "nemotron-3-ultra-free",
        "nemotron-3.5-lightning-free",
        "hy3-free",
        "laguna-s-2.1-free",
        "ling-3.0-tiny-free",
        "deepseek-v4-flash-free",
        "mimo-v2.5-free"
      ],
      "model_protocols": {},
      "chat_completions_path": null,
      "cost_class": "zero",
      "estimated_cost_microusd_per_request": null,
      "privacy_class": "hosted_anonymous"
    }
  ],
  "single_reviewer": {
    "targets": [
      {
        "provider_id": "opencode_anonymous",
        "model": "mimo-v2.5-free"
      }
    ]
  },
  "ensemble": null,
  "challenger": {
    "targets": [
      {
        "provider_id": "opencode_anonymous",
        "model": "mimo-v2.5-free"
      }
    ]
  },
  "alternative_comparator": null,
  "review_budget": {
    "max_requests": 64,
    "max_input_bytes": 8388608,
    "max_output_tokens": 2048,
    "timeout_ms": 360000,
    "max_cost_microusd": 0,
    "allow_unknown_cost": false
  },
  "case_budgets": {
    "defaults": {
      "max_requests": 12,
      "max_input_bytes": 2097152,
      "max_output_tokens": 2048,
      "timeout_ms": 360000,
      "max_cost_microusd": 0,
      "allow_unknown_cost": false
    },
    "per_template": {}
  }
}
